{
  "$schema": "http://json-schema.org/draft-07/schema#",
  "title": "Deck",
  "description": "Manifest for a slide deck. Lives at decks/<name>/deck.json.",
  "type": "object",
  "required": ["title", "slides"],
  "additionalProperties": false,
  "properties": {
    "$schema": {
      "type": "string",
      "description": "Pointer to this schema. Optional, but enables editor autocomplete."
    },
    "title": {
      "type": "string",
      "description": "Human-readable deck title (shown in the viewer)."
    },
    "description": {
      "type": "string",
      "description": "One-line summary of what the deck is for."
    },
    "author": {
      "type": "string"
    },
    "createdAt": {
      "type": "string",
      "format": "date",
      "description": "ISO date (YYYY-MM-DD)."
    },
    "slides": {
      "type": "array",
      "description": "Ordered list of slides. Each entry is a path from project root, either 'slides/...' (shared) or 'decks/<name>/slides/...' (deck-local).",
      "items": {
        "type": "string",
        "pattern": "^(slides/.+\\.tsx|decks/[^/]+/slides/.+\\.tsx)$"
      }
    }
  }
}
